{
    "project_name": "apollo",
    "file_name": "GlobalDefaultExceptionHandler.java",
    "relative_path": "apollo/apollo-common/src/main/java/com/ctrip/framework/apollo/common/controller/GlobalDefaultExceptionHandler.java",
    "execute_path": "apollo",
    "package": "com.ctrip.framework.apollo.common.controller",
    "docstring": null,
    "source_code": "//\u6253\u5370\u65e5\u5fd7, \u5176\u4e2dlogLevel\u4e3a\u65e5\u5fd7\u7ea7\u522b: ERROR/WARN/DEBUG/INFO/TRACE\nprivate void printLog(String message, Throwable ex, Level logLevel) {\n  switch (logLevel) {\n    case ERROR:\n      logger.error(message, ex);\n      break;\n    case WARN:\n      logger.warn(message, ex);\n      break;\n    case DEBUG:\n      logger.debug(message, ex);\n      break;\n    case INFO:\n      logger.info(message, ex);\n      break;\n    case TRACE:\n      logger.trace(message, ex);\n      break;\n  }\n\n  Tracer.logError(ex);\n}\n",
    "class_name": "GlobalDefaultExceptionHandler",
    "method_name": "printLog",
    "arguments": [
        "String message",
        "Throwable ex",
        "Level logLevel"
    ],
    "generate_test": [
        "\npackage com.ctrip.framework.apollo.common.controller;\n\nimport org.junit.jupiter.api.*;\nimport static org.junit.jupiter.api.Assertions.*;\n\npublic class GlobalDefaultExceptionHandlerTest {\n    @Test\n    public void printLogTest() {\n        String message = \"test message\";\n        Throwable ex = new Exception(\"test exception\");\n        Level logLevel = Level.ERROR;\n        \n        // Call the method under test\n        printLog(message, ex, logLevel);\n        \n        // Verify that the logger was called with the expected arguments\n        verify(logger).error(message, ex);\n    }\n}\n",
        "package com.ctrip.framework.apollo.common.controller;\n\nimport org.junit.jupiter.api.*;\nimport static org.junit.jupiter.api.Assertions.*;\n\npublic class GlobalDefaultExceptionHandlerTest {\n    @Test\n    public void printLogTest() {\n        String message = \"This is a test message\";\n        Throwable ex = new RuntimeException(\"This is a test exception\");\n        Level logLevel = Level.DEBUG;\n\n        // Set up the logger mock to verify that it logs the expected messages\n        Logger loggerMock = mock(Logger.class);\n        doNothing().when(loggerMock).debug(anyString(), any());\n\n        GlobalDefaultExceptionHandler handler = new GlobalDefaultExceptionHandler();\n        handler.printLog(message, ex, logLevel);\n\n        // Verify that the logger was called with the expected message and exception\n        verify(loggerMock).debug(\"{}: {}\", message, ex);\n    }\n}",
        "\npackage com.ctrip.framework.apollo.common.controller;\n\nimport org.junit.jupiter.api.*;\nimport static org.junit.jupiter.api.Assertions.*;\n\npublic class GlobalDefaultExceptionHandlerTest {\n    @Test\n    public void printLogTest() {\n        Level logLevel = Level.ERROR;\n        String message = \"This is an error message\";\n        Throwable ex = new RuntimeException();\n        \n        assertEquals(logLevel, logger.error(message, ex));\n    }\n}",
        "package com.ctrip.framework.apollo.common.controller;\n\nimport org.junit.jupiter.api.*;\nimport static org.junit.jupiter.api.Assertions.*;\n\npublic class GlobalDefaultExceptionHandlerTest {\n    @Test\n    public void printLogTest() {\n        // Arrange\n        String message = \"This is a test log\";\n        Throwable ex = new RuntimeException(\"Test Exception\");\n        Level logLevel = Level.DEBUG;\n        \n        // Act\n        GlobalDefaultExceptionHandler.printLog(message, ex, logLevel);\n        \n        // Assert\n        assertTrue(true);\n    }\n}",
        "package com.ctrip.framework.apollo.common.controller;\n\nimport org.junit.jupiter.api.*;\nimport static org.junit.jupiter.api.Assertions.*;\n\npublic class GlobalDefaultExceptionHandlerTest {\n    @Test\n    public void printLogTest() {\n        String message = \"This is a test message\";\n        Throwable ex = new RuntimeException(\"Test exception\");\n        Level logLevel = Level.ERROR;\n        \n        GlobalDefaultExceptionHandler handler = new GlobalDefaultExceptionHandler();\n        handler.printLog(message, ex, logLevel);\n        \n        assertTrue(logger.getLastLog().contains(message));\n    }\n}",
        "package com.ctrip.framework.apollo.common.controller;\n\nimport org.junit.jupiter.api.*;\nimport static org.junit.jupiter.api.Assertions.*;\n\npublic class GlobalDefaultExceptionHandlerTest {\n    @Test\n    public void printLogTest() {\n        String message = \"This is a test message\";\n        Throwable ex = new Exception(\"Test exception\");\n        Level logLevel = Level.ERROR;\n        \n        // Arrange\n        GlobalDefaultExceptionHandler globalDefaultExceptionHandler = new GlobalDefaultExceptionHandler();\n        \n        // Act\n        globalDefaultExceptionHandler.printLog(message, ex, logLevel);\n        \n        // Assert\n        assertEquals(\"This is a test message\", globalDefaultExceptionHandler.getMessage());\n        assertEquals(ex, globalDefaultExceptionHandler.getException());\n        assertEquals(logLevel, globalDefaultExceptionHandler.getLevel());\n    }\n}",
        "\nimport org.junit.jupiter.api.*;\nimport static org.junit.jupiter.api.Assertions.*;\n\npublic class GlobalDefaultExceptionHandlerTest {\n    @Test\n    public void printLogTest() {\n        Level logLevel = Level.ERROR;\n        String message = \"This is a test message\";\n        Throwable ex = new Exception(\"This is a test exception\");\n        \n        // Arrange\n        GlobalDefaultExceptionHandler instance = new GlobalDefaultExceptionHandler();\n        \n        // Act\n        instance.printLog(message, ex, logLevel);\n        \n        // Assert\n        assertTrue(ex.getMessage().contains(message));\n    }\n}\n",
        "package com.ctrip.framework.apollo.common.controller;\n\nimport org.junit.jupiter.api.*;\nimport static org.junit.jupiter.api.Assertions.*;\n\npublic class GlobalDefaultExceptionHandlerTest {\n    @Test\n    public void printLogTest() {\n        // Arrange\n        String message = \"This is a test message\";\n        Throwable ex = new IllegalArgumentException();\n        Level logLevel = Level.ERROR;\n        \n        // Act\n        printLog(message, ex, logLevel);\n        \n        // Assert\n        assertEquals(logger.getLastMessage(), \"This is a test message\");\n    }\n}",
        "package com.ctrip.framework.apollo.common.controller;\n\nimport org.junit.jupiter.api.*;\nimport static org.junit.jupiter.api.Assertions.*;\n\npublic class GlobalDefaultExceptionHandlerTest {\n    @Test\n    public void printLogTest() {\n        // Arrange\n        String message = \"This is a test message\";\n        Throwable ex = new Exception(\"Test exception\");\n        Level logLevel = Level.ERROR;\n\n        // Act\n        GlobalDefaultExceptionHandler handler = new GlobalDefaultExceptionHandler();\n        handler.printLog(message, ex, logLevel);\n\n        // Assert\n        assertTrue(true);\n    }\n}",
        "\npackage com.ctrip.framework.apollo.common.controller;\n\nimport org.junit.jupiter.api.*;\nimport static org.junit.jupiter.api.Assertions.*;\n\npublic class GlobalDefaultExceptionHandlerTest {\n    @Test\n    public void printLogTest() {\n        // Test with error log level\n        String message = \"Error message\";\n        Throwable ex = new Exception(\"Test exception\");\n        Level logLevel = Level.ERROR;\n        assertEquals(logger.error(message, ex), logger.error(message + \": \" + ex.getMessage()));\n        \n        // Test with warn log level\n        message = \"Warn message\";\n        ex = new Exception(\"Test exception\");\n        logLevel = Level.WARN;\n        assertEquals(logger.warn(message, ex), logger.warn(message + \": \" + ex.getMessage()));\n        \n        // Test with debug log level\n        message = \"Debug message\";\n        ex = new Exception(\"Test exception\");\n        logLevel = Level.DEBUG;\n        assertEquals(logger.debug(message, ex), logger.debug(message + \": \" + ex.getMessage()));\n        \n        // Test with info log level\n        message = \"Info message\";\n        ex = new Exception(\"Test exception\");\n        logLevel = Level.INFO;\n        assertEquals(logger.info(message, ex), logger.info(message + \": \" + ex.getMessage()));\n        \n        // Test with trace log level\n        message = \"Trace message\";\n        ex = new Exception(\"Test exception\");\n        logLevel = Level.TRACE;\n        assertEquals(logger.trace(message, ex), logger.trace(message + \": \" + ex.getMessage()));\n    }\n}\n"
    ]
}