{
    "project_name": "apollo",
    "file_name": "ApolloEurekaClientConfig.java",
    "relative_path": "apollo/apollo-biz/src/main/java/com/ctrip/framework/apollo/biz/eureka/ApolloEurekaClientConfig.java",
    "execute_path": "apollo",
    "package": "com.ctrip.framework.apollo.biz.eureka",
    "docstring": "/**\n   * Assert only one zone: defaultZone, but multiple environments.\n   */",
    "source_code": "\n@Override\npublic List<String> getEurekaServerServiceUrls(String myZone) {\n  List<String> urls = bizConfig.eurekaServiceUrls();\n  return CollectionUtils.isEmpty(urls) ? super.getEurekaServerServiceUrls(myZone) : urls;\n}\n",
    "class_name": "ApolloEurekaClientConfig",
    "method_name": "getEurekaServerServiceUrls",
    "arguments": [
        "String myZone"
    ],
    "generate_test": [
        "package com.ctrip.framework.apollo.biz.eureka;\n\nimport org.junit.jupiter.api.*;\nimport static org.junit.jupiter.api.Assertions.*;\n\npublic class ApolloEurekaClientConfigTest {\n    @Test\n    public void getEurekaServerServiceUrlsTest() {\n        List<String> expectedUrls = Arrays.asList(\"https://eureka1\", \"https://eureka2\");\n        \n        // Mock the BizConfig class to return the expected URLs\n        BizConfig bizConfig = mock(BizConfig.class);\n        when(bizConfig.eurekaServiceUrls()).thenReturn(expectedUrls);\n        \n        // Create a new instance of ApolloEurekaClientConfig with the mocked BizConfig\n        ApolloEurekaClientConfig config = new ApolloEurekaClientConfig(bizConfig);\n        \n        // Test the getEurekaServerServiceUrls method\n        List<String> actualUrls = config.getEurekaServerServiceUrls(\"myZone\");\n        \n        // Verify that the expected and actual URLs are equal\n        assertEquals(expectedUrls, actualUrls);\n    }\n}",
        "@Test\npublic void getEurekaServerServiceUrlsTest() {\n    String myZone = \"myZone\";\n    List<String> urls = Arrays.asList(\"http://localhost:8080/eureka\");\n    \n    Mockito.when(bizConfig.eurekaServiceUrls()).thenReturn(urls);\n    ApolloEurekaClientConfig config = new ApolloEurekaClientConfig();\n    List<String> result = config.getEurekaServerServiceUrls(myZone);\n    \n    assertEquals(1, result.size());\n    assertEquals(\"http://localhost:8080/eureka\", result.get(0));\n}",
        "package com.ctrip.framework.apollo.biz.eureka;\n\nimport org.junit.jupiter.api.*;\nimport static org.junit.jupiter.api.Assertions.*;\n\npublic class ApolloEurekaClientConfigTest {\n    @Test\n    public void getEurekaServerServiceUrlsTest() {\n        String myZone = \"myZone\";\n        List<String> urls = Arrays.asList(\"http://localhost:8761/eureka\", \"http://localhost:8762/eureka\");\n        \n        ApolloEurekaClientConfig config = new ApolloEurekaClientConfig();\n        config.bizConfig = mock(BizConfig.class);\n        when(config.bizConfig.eurekaServiceUrls()).thenReturn(urls);\n        \n        assertEquals(urls, config.getEurekaServerServiceUrls(myZone));\n    }\n}",
        "I'm happy to help you with your question! However, I noticed that the code snippet you provided is not complete and does not contain a method or class definition. Please provide a complete code example so I can better understand what you are trying to accomplish and provide a helpful response.",
        "\npackage com.ctrip.framework.apollo.biz.eureka;\n\nimport org.junit.jupiter.api.*;\nimport static org.junit.jupiter.api.Assertions.*;\n\npublic class ApolloEurekaClientConfigTest {\n    @Test\n    public void getEurekaServerServiceUrlsTest() {\n        // Test with empty list of URLs\n        List<String> urls = new ArrayList<>();\n        assertEquals(Collections.emptyList(), getEurekaServerServiceUrls(\"myZone\"));\n        \n        // Test with non-empty list of URLs\n        urls.add(\"http://localhost:8080\");\n        assertEquals(urls, getEurekaServerServiceUrls(\"myZone\"));\n        \n        // Test with null input\n        assertThrows(NullPointerException.class, () -> getEurekaServerServiceUrls(null));\n    }\n}\n",
        "@Test\npublic void getEurekaServerServiceUrlsTest() {\n    ApolloEurekaClientConfig config = new ApolloEurekaClientConfig();\n    List<String> urls = config.getEurekaServerServiceUrls(\"myZone\");\n    assertEquals(urls, Arrays.asList(\"url1\", \"url2\"));\n}",
        "\n@Test\npublic void getEurekaServerServiceUrlsTest() {\n    ApolloEurekaClientConfig config = new ApolloEurekaClientConfig();\n    List<String> urls = Arrays.asList(\"http://localhost:8080\", \"http://example.com\");\n    when(config.getEurekaServerServiceUrls()).thenReturn(urls);\n    \n    assertEquals(urls, config.getEurekaServerServiceUrls());\n}",
        "import org.junit.jupiter.api.*;\nimport static org.junit.jupiter.api.Assertions.*;\n\npublic class ApolloEurekaClientConfigTest {\n    @Test\n    public void getEurekaServerServiceUrlsTest() {\n        // Arrange\n        String myZone = \"us-east-1\";\n        \n        // Act\n        List<String> urls = bizConfig.eurekaServiceUrls();\n        \n        // Assert\n        assertTrue(CollectionUtils.isEmpty(urls));\n    }\n}",
        "package com.ctrip.framework.apollo.biz.eureka;\n\nimport org.junit.jupiter.api.*;\nimport static org.junit.jupiter.api.Assertions.*;\n\npublic class ApolloEurekaClientConfigTest {\n    @Test\n    public void getEurekaServerServiceUrlsTest() {\n        // Set up mock environment\n        BizConfig bizConfig = new BizConfig();\n        ApolloEurekaClientConfig clientConfig = new ApolloEurekaClientConfig(bizConfig);\n\n        // Test with empty list\n        List<String> urls = Collections.emptyList();\n        assertEquals(super.getEurekaServerServiceUrls(\"myZone\"), clientConfig.getEurekaServerServiceUrls(\"myZone\"));\n\n        // Test with non-empty list\n        urls = Arrays.asList(\"http://example.com/eureka\");\n        assertEquals(urls, clientConfig.getEurekaServerServiceUrls(\"myZone\"));\n    }\n}",
        "\npackage com.ctrip.framework.apollo.biz.eureka;\n\nimport org.junit.jupiter.api.*;\nimport static org.junit.jupiter.api.Assertions.*;\n\npublic class ApolloEurekaClientConfigTest {\n    @Test\n    public void getEurekaServerServiceUrlsTest() {\n        String myZone = \"my-zone\";\n        List<String> urls = Collections.singletonList(\"https://example.com\");\n        \n        // Test case 1: when the list of URLs is not empty\n        ApolloEurekaClientConfig config = new ApolloEurekaClientConfig();\n        config.setBizConfig(new BizConfig() {\n            @Override\n            public List<String> eurekaServiceUrls() {\n                return urls;\n            }\n        });\n        \n        assertEquals(urls, config.getEurekaServerServiceUrls(myZone));\n        \n        // Test case 2: when the list of URLs is empty\n        config = new ApolloEurekaClientConfig();\n        config.setBizConfig(new BizConfig() {\n            @Override\n            public List<String> eurekaServiceUrls() {\n                return Collections.emptyList();\n            }\n        });\n        \n        assertEquals(super.getEurekaServerServiceUrls(myZone), config.getEurekaServerServiceUrls(myZone));\n    }\n}"
    ]
}