{
    "project_name": "apollo",
    "file_name": "AppController.java",
    "relative_path": "apollo/apollo-portal/src/main/java/com/ctrip/framework/apollo/openapi/v1/controller/AppController.java",
    "execute_path": "apollo",
    "package": "com.ctrip.framework.apollo.openapi.v1.controller",
    "docstring": "/**\n   * @see com.ctrip.framework.apollo.portal.controller.AppController#create(AppModel)\n   */",
    "source_code": "\n@Transactional\n@PreAuthorize(value = \"@consumerPermissionValidator.hasCreateApplicationPermission(#request)\")\n@PostMapping(value = \"/apps\")\npublic void createApp(\n    @RequestBody OpenCreateAppDTO req,\n    HttpServletRequest request\n) {\n  if (null == req.getApp()) {\n    throw new BadRequestException(\"App is null\");\n  }\n  final OpenAppDTO app = req.getApp();\n  if (null == app.getAppId()) {\n    throw new BadRequestException(\"AppId is null\");\n  }\n  // create app\n  this.appOpenApiService.createApp(req);\n  if (req.isAssignAppRoleToSelf()) {\n    long consumerId = this.consumerAuthUtil.retrieveConsumerId(request);\n    consumerService.assignAppRoleToConsumer(consumerId, app.getAppId());\n  }\n}\n",
    "class_name": "AppController",
    "method_name": "createApp",
    "arguments": [
        "OpenCreateAppDTO req",
        "HttpServletRequest request"
    ],
    "generate_test": [
        "\n@Test\npublic void createAppTest() {\n    OpenCreateAppDTO req = new OpenCreateAppDTO();\n    req.setApp(new OpenAppDTO());\n    req.getApp().setAppId(\"app1\");\n    req.setAssignAppRoleToSelf(true);\n\n    HttpServletRequest request = Mockito.mock(HttpServletRequest.class);\n    Mockito.when(request.getAttribute(Mockito.anyString())).thenReturn(\"consumerId\");\n\n    AppController controller = new AppController();\n    assertDoesNotThrow(() -> controller.createApp(req, request));\n}",
        "package com.ctrip.framework.apollo.openapi.v1.controller;\n\nimport static org.mockito.Mockito.*;\n\nimport java.util.Arrays;\n\nimport org.junit.jupiter.api.BeforeEach;\nimport org.junit.jupiter.api.Test;\nimport org.junit.jupiter.api.extension.ExtendWith;\nimport org.mockito.Mock;\nimport org.mockito.junit.jupiter.MockitoExtension;\nimport org.springframework.security.access.prepost.PreAuthorize;\nimport org.springframework.web.bind.annotation.*;\n\nimport com.ctrip.framework.apollo.common.exception.BadRequestException;\nimport com.ctrip.framework.apollo.openapi.api.AppOpenApiService;\nimport com.ctrip.framework.apollo.openapi.dto.OpenCreateAppDTO;\nimport com.ctrip.framework.apollo.openapi.service.ConsumerService;\nimport com.ctrip.framework.apollo.openapi.util.ConsumerAuthUtil;\nimport com.ctrip.framework.apollo.openapi.dto.OpenAppDTO;\nimport com.ctrip.framework.apollo.openapi.dto.OpenEnvClusterDTO;\n\n@ExtendWith(MockitoExtension.class)\npublic class AppControllerTest {\n\n    @Mock\n    private ConsumerAuthUtil consumerAuthUtil;\n\n    @Mock\n    private ConsumerService consumerService;\n\n    @Mock\n    private AppOpenApiService appOpenApiService;\n\n    private AppController appController;\n\n    @BeforeEach\n    public void setup() {\n        appController = new AppController(consumerAuthUtil, consumerService, appOpenApiService);\n    }\n\n    @Test\n    public void createAppTest() throws Exception {\n        OpenCreateAppDTO req = mock(OpenCreateAppDTO.class);\n        HttpServletRequest request = mock(HttpServletRequest.class);\n\n        when(req.getApp()).thenReturn(mock(OpenAppDTO.class));\n        when(consumerAuthUtil.retrieveConsumerId(request)).thenReturn(\"1\");\n        when(appOpenApiService.createApp(eq(req))).thenReturn(true);\n        when(consumerService.findAppIdsAuthorizedByConsumerId(anyString())).thenReturn(Arrays.asList(\"1\"));\n\n        appController.createApp(req, request);\n\n        verify(appOpenApiService, times(1)).createApp(eq(req));\n    }\n}",
        "package com.ctrip.framework.apollo.openapi.v1.controller;\n\nimport org.junit.jupiter.api.*;\nimport static org.junit.jupiter.api.Assertions.*;\n\npublic class AppControllerTest {\n    @Test\n    public void createAppTest() {\n        AppController appController = new AppController();\n        \n        // Test that a BadRequestException is thrown when the request body is null\n        OpenCreateAppDTO req = null;\n        HttpServletRequest request = null;\n        assertThrows(BadRequestException.class, () -> appController.createApp(req, request));\n        \n        // Test that a BadRequestException is thrown when the app ID is null\n        req = new OpenCreateAppDTO();\n        request = mock(HttpServletRequest.class);\n        assertThrows(BadRequestException.class, () -> appController.createApp(req, request));\n    }\n}",
        "package com.ctrip.framework.apollo.openapi.v1.controller;\n\nimport org.junit.jupiter.api.*;\nimport static org.junit.jupiter.api.Assertions.*;\n\npublic class AppControllerTest {\n    @Test\n    public void createAppTest() {\n        // Set up test data\n        OpenCreateAppDTO req = new OpenCreateAppDTO();\n        HttpServletRequest request = Mockito.mock(HttpServletRequest.class);\n        \n        // Null or empty request body\n        try {\n            AppController controller = new AppController();\n            controller.createApp(null, request);\n            fail(\"Expected BadRequestException\");\n        } catch (BadRequestException e) {\n            assertEquals(e.getMessage(), \"App is null\");\n        }\n        \n        // Invalid AppId\n        req.setAppId(null);\n        try {\n            AppController controller = new AppController();\n            controller.createApp(req, request);\n            fail(\"Expected BadRequestException\");\n        } catch (BadRequestException e) {\n            assertEquals(e.getMessage(), \"AppId is null\");\n        }\n        \n        // Valid request body and AppId\n        req.setApp(new OpenAppDTO());\n        req.getApp().setAppId(\"test-app\");\n        AppController controller = new AppController();\n        controller.createApp(req, request);\n        \n        // Assign app role to self flag set to true\n        try {\n            req.setAssignAppRoleToSelf(true);\n            controller.createApp(req, request);\n            fail(\"Expected BadRequestException\");\n        } catch (BadRequestException e) {\n            assertEquals(e.getMessage(), \"Invalid assign app role to self flag value\");\n        }\n    }\n}",
        "import org.junit.jupiter.api.*;\nimport static org.junit.jupiter.api.Assertions.*;\n\npublic class AppControllerTest {\n    @Test\n    public void createAppTest() {\n        OpenCreateAppDTO req = new OpenCreateAppDTO();\n        req.setApp(new OpenAppDTO());\n        req.getApp().setAppId(\"test-app\");\n        \n        HttpServletRequest request = Mockito.mock(HttpServletRequest.class);\n        Mockito.when(request.getParameter(\"appIds\")).thenReturn(\"test-app\");\n        \n        AppController appController = new AppController();\n        ResponseEntity<OpenAppDTO> response = appController.createApp(req, request);\n        \n        assertEquals(HttpStatus.CREATED, response.getStatusCode());\n        assertTrue(response.hasBody());\n        OpenAppDTO app = response.getBody();\n        assertNotNull(app);\n        assertEquals(\"test-app\", app.getAppId());\n    }\n}",
        "package com.ctrip.framework.apollo.openapi.v1.controller;\n\nimport org.junit.jupiter.api.*;\nimport static org.junit.jupiter.api.Assertions.*;\n\npublic class AppControllerTest {\n    @Test\n    public void createAppTest() {\n        // Arrange\n        OpenCreateAppDTO req = new OpenCreateAppDTO();\n        req.setApp(new OpenAppDTO());\n        req.getApp().setAppId(\"appId\");\n        req.setAssignAppRoleToSelf(true);\n        \n        HttpServletRequest request = mock(HttpServletRequest.class);\n        when(request.getAttribute(anyString())).thenReturn(\"consumerId\");\n        \n        ConsumerService consumerService = new ConsumerService();\n        AppOpenApiService appOpenApiService = new AppOpenApiService();\n        \n        // Act\n        AppController controller = new AppController(mock(ConsumerAuthUtil.class), consumerService, appOpenApiService);\n        String result = controller.createApp(req, request);\n        \n        // Assert\n        assertEquals(\"appId\", result);\n    }\n}",
        "\n@Test\npublic void createAppTest() {\n    // Arrange\n    OpenCreateAppDTO req = new OpenCreateAppDTO();\n    HttpServletRequest request = Mockito.mock(HttpServletRequest.class);\n    when(request.getAttribute(\"openApiOperationId\")).thenReturn(\"createApp\");\n\n    AppController appController = new AppController(consumerAuthUtil, consumerService, appOpenApiService);\n\n    // Act\n    appController.createApp(req, request);\n\n    // Assert\n    verify(appOpenApiService).createApp(req);\n}",
        "package com.ctrip.framework.apollo.openapi.v1.controller;\n\nimport org.junit.jupiter.api.*;\nimport static org.mockito.Mockito.*;\nimport static org.junit.jupiter.api.Assertions.*;\n\npublic class AppControllerTest {\n    private final ConsumerAuthUtil consumerAuthUtil = mock(ConsumerAuthUtil.class);\n    private final ConsumerService consumerService = mock(ConsumerService.class);\n    private final AppOpenApiService appOpenApiService = mock(AppOpenApiService.class);\n    \n    @Test\n    public void createAppTest() {\n        when(consumerAuthUtil.retrieveConsumerId(any())).thenReturn(1L);\n        when(appOpenApiService.createApp(any())).thenReturn(\"success\");\n        \n        AppController appController = new AppController(consumerAuthUtil, consumerService, appOpenApiService);\n        String actualResult = appController.createApp(new OpenCreateAppDTO(), mock(HttpServletRequest.class));\n        \n        assertEquals(\"success\", actualResult);\n    }\n}",
        "The provided JUnit test case for the `createApp` method in the `AppController` class is incomplete. To complete it, you need to add more assertions and tests to ensure that the method behaves as expected.\n\nHere are some suggestions on how to improve the test case:\n\n1. Test that the `req.getApp()` method returns a non-null value when called with a valid request body.\n2. Test that the `OpenAppDTO` class is properly initialized and has all the required fields set when it is created.\n3. Test that the `consumerAuthUtil.retrieveConsumerId(request)` method returns a non-zero value when called with a valid HTTP request.\n4. Test that the `appOpenApiService.createApp(req)` method behaves correctly when called with a valid `OpenCreateAppDTO` object.\n5. Test that the `consumerService.assignAppRoleToConsumer(consumerId, app.getAppId())` method behaves correctly when called with a valid `consumerId` and `appId`.\n6. Test that the `req.isAssignAppRoleToSelf()` method returns a non-null value when called with a valid request body.\n7. Test that the `appOpenApiService.getEnvClusterInfo(appId)` method behaves correctly when called with a valid `appId`.\n8. Test that the `appOpenApiService.getAppsInfo(Arrays.asList(appIds.split(\",\")))` method behaves correctly when called with a valid list of `appIds`.\n9. Test that the `consumerService.findAppIdsAuthorizedByConsumerId(consumerId)` method behaves correctly when called with a valid `consumerId`.\n10. Test that the `appOpenApiService.getAllApps()` method behaves correctly when called without any parameters.\n\nYou can add these tests to the existing test case and modify it as needed to ensure that the `createApp` method in the `AppController` class behaves correctly for all possible input values.",
        "package com.ctrip.framework.apollo.openapi.v1.controller;\n\nimport org.junit.jupiter.api.*;\nimport static org.junit.jupiter.api.Assertions.*;\n\npublic class AppControllerTest {\n    @Test\n    public void createAppTest() {\n        // Set up the test data\n        OpenCreateAppDTO req = new OpenCreateAppDTO();\n        HttpServletRequest request = mock(HttpServletRequest.class);\n        when(request.getAttribute(\"app\")).thenReturn(req);\n\n        // Call the method under test\n        AppController controller = new AppController();\n        controller.createApp(req, request);\n\n        // Verify that the app was created successfully\n        assertNotNull(req.getApp());\n    }\n}"
    ]
}