{
    "project_name": "apollo",
    "file_name": "NamespaceBranchService.java",
    "relative_path": "apollo/apollo-biz/src/main/java/com/ctrip/framework/apollo/biz/service/NamespaceBranchService.java",
    "execute_path": "apollo",
    "package": "com.ctrip.framework.apollo.biz.service",
    "docstring": null,
    "source_code": "@Transactional\npublic GrayReleaseRule updateRulesReleaseId(String appId, String clusterName,\n                                 String namespaceName, String branchName,\n                                 long latestReleaseId, String operator) {\n  GrayReleaseRule oldRules = grayReleaseRuleRepository.\n      findTopByAppIdAndClusterNameAndNamespaceNameAndBranchNameOrderByIdDesc(appId, clusterName, namespaceName, branchName);\n\n  if (oldRules == null) {\n    return null;\n  }\n\n  GrayReleaseRule newRules = new GrayReleaseRule();\n  newRules.setBranchStatus(NamespaceBranchStatus.ACTIVE);\n  newRules.setReleaseId(latestReleaseId);\n  newRules.setRules(oldRules.getRules());\n  newRules.setAppId(oldRules.getAppId());\n  newRules.setClusterName(oldRules.getClusterName());\n  newRules.setNamespaceName(oldRules.getNamespaceName());\n  newRules.setBranchName(oldRules.getBranchName());\n  newRules.setDataChangeCreatedBy(operator);\n  newRules.setDataChangeLastModifiedBy(operator);\n\n  grayReleaseRuleRepository.save(newRules);\n\n  grayReleaseRuleRepository.delete(oldRules);\n\n  return newRules;\n}\n",
    "class_name": "NamespaceBranchService",
    "method_name": "updateRulesReleaseId",
    "arguments": [
        "String appId",
        "String clusterName",
        "String namespaceName",
        "String branchName",
        "long latestReleaseId",
        "String operator"
    ],
    "generate_test": [
        "@Test\npublic void updateRulesReleaseIdTest() {\n    // Create a new namespace branch with some initial values\n    String appId = \"my-app\";\n    String clusterName = \"my-cluster\";\n    String namespaceName = \"my-namespace\";\n    String branchName = \"my-branch\";\n    NamespaceBranchService service = new NamespaceBranchService();\n    service.createBranch(appId, clusterName, namespaceName, branchName);\n    \n    // Update the rules for the branch with a new release ID\n    long latestReleaseId = 100;\n    GrayReleaseRule updatedRules = service.updateRulesReleaseId(appId, clusterName, namespaceName, branchName, latestReleaseId);\n    \n    // Verify that the update was successful by checking that the release ID matches\n    assertEquals(latestReleaseId, updatedRules.getReleaseId());\n}",
        "@Test\npublic void updateRulesReleaseIdTest() {\n    // Set up test data\n    String appId = \"12345\";\n    String clusterName = \"default\";\n    String namespaceName = \"application\";\n    String branchName = \"test-branch\";\n    long latestReleaseId = 99;\n    String operator = \"test-user\";\n    \n    // Create a new instance of NamespaceBranchService\n    NamespaceBranchService service = new NamespaceBranchService(null, null, null, null, null);\n    \n    // Call the method to be tested\n    GrayReleaseRule updatedRules = service.updateRulesReleaseId(appId, clusterName, namespaceName, branchName, latestReleaseId, operator);\n    \n    // Verify that the returned object is not null\n    assertNotNull(updatedRules);\n    \n    // Verify that the release ID of the updated rules matches the expected value\n    assertEquals(latestReleaseId, updatedRules.getReleaseId());\n}",
        "package com.ctrip.framework.apollo.biz.service;\n\nimport org.junit.jupiter.api.*;\nimport static org.junit.jupiter.api.Assertions.*;\n\npublic class NamespaceBranchServiceTest {\n    @Test\n    public void updateRulesReleaseIdTest() {\n        // Arrange\n        String appId = \"my-app\";\n        String clusterName = \"my-cluster\";\n        String namespaceName = \"my-namespace\";\n        String branchName = \"my-branch\";\n        long latestReleaseId = 123L;\n        String operator = \"user@example.com\";\n        \n        NamespaceBranchService service = new NamespaceBranchService(null, null, null, null, null);\n        \n        // Act\n        GrayReleaseRule updatedRules = service.updateRulesReleaseId(appId, clusterName, namespaceName, branchName, latestReleaseId, operator);\n        \n        // Assert\n        assertNotNull(updatedRules);\n        assertEquals(latestReleaseId, updatedRules.getReleaseId());\n    }\n}",
        "package com.ctrip.framework.apollo.biz.service;\n\nimport org.junit.jupiter.api.*;\nimport static org.junit.jupiter.api.Assertions.*;\n\npublic class NamespaceBranchServiceTest {\n    @Test\n    public void updateRulesReleaseIdTest() {\n        // Arrange\n        String appId = \"myApp\";\n        String clusterName = \"myCluster\";\n        String namespaceName = \"myNamespace\";\n        String branchName = \"myBranch\";\n        long latestReleaseId = 123L;\n        String operator = \"testuser\";\n        \n        // Act\n        GrayReleaseRule updatedRules = namespaceBranchService.updateRulesReleaseId(appId, clusterName, namespaceName, branchName, latestReleaseId, operator);\n        \n        // Assert\n        assertNotNull(updatedRules);\n        assertEquals(latestReleaseId, updatedRules.getReleaseId());\n        assertEquals(operator, updatedRules.getDataChangeLastModifiedBy());\n    }\n}",
        "package com.ctrip.framework.apollo.biz.service;\n\nimport org.junit.jupiter.api.*;\nimport static org.junit.jupiter.api.Assertions.*;\n\npublic class NamespaceBranchServiceTest {\n    @Test\n    public void updateRulesReleaseIdTest() {\n        GrayReleaseRuleRepository grayReleaseRuleRepository = mock(GrayReleaseRuleRepository.class);\n        \n        GrayReleaseRule oldRules = new GrayReleaseRule();\n        oldRules.setBranchStatus(NamespaceBranchStatus.ACTIVE);\n        oldRules.setReleaseId(12345L);\n        oldRules.setAppId(\"test-app\");\n        \n        when(grayReleaseRuleRepository.findTopByAppIdAndClusterNameAndNamespaceNameAndBranchNameOrderByIdDesc(anyString(), anyString(), anyString(), anyString())).thenReturn(oldRules);\n        \n        NamespaceBranchService namespaceBranchService = new NamespaceBranchService(grayReleaseRuleRepository);\n        GrayReleaseRule newRules = namespaceBranchService.updateRulesReleaseId(\"test-app\", \"test-cluster\", \"test-namespace\", \"test-branch\", 12345L, \"admin\");\n        \n        assertEquals(oldRules.getAppId(), newRules.getAppId());\n        assertEquals(oldRules.getBranchStatus(), newRules.getBranchStatus());\n        assertEquals(oldRules.getReleaseId() + 1, newRules.getReleaseId());\n        \n    }\n}",
        "package com.ctrip.framework.apollo.biz.service;\n\nimport org.junit.jupiter.api.*;\nimport static org.junit.jupiter.api.Assertions.*;\n\npublic class NamespaceBranchServiceTest {\n    @Test\n    public void updateRulesReleaseIdTest() {\n        // Arrange\n        String appId = \"App123\";\n        String clusterName = \"Cluster1\";\n        String namespaceName = \"Namespace1\";\n        String branchName = \"Branch1\";\n        long latestReleaseId = 100L;\n        String operator = \"Operator1\";\n\n        NamespaceBranchService service = new NamespaceBranchService(null, null, null, null, null, null);\n\n        // Act\n        GrayReleaseRule result = service.updateRulesReleaseId(appId, clusterName, namespaceName, branchName, latestReleaseId, operator);\n\n        // Assert\n        assertNotNull(result);\n        assertEquals(NamespaceBranchStatus.ACTIVE, result.getBranchStatus());\n        assertEquals(latestReleaseId, result.getReleaseId());\n    }\n}",
        "package com.ctrip.framework.apollo.biz.service;\n\nimport org.junit.jupiter.api.*;\nimport static org.junit.jupiter.api.Assertions.*;\n\npublic class NamespaceBranchServiceTest {\n    @Test\n    public void updateRulesReleaseIdTest() {\n        // Arrange\n        GrayReleaseRuleRepository grayReleaseRuleRepository = mock(GrayReleaseRuleRepository.class);\n        ClusterService clusterService = mock(ClusterService.class);\n        ReleaseService releaseService = mock(ReleaseService.class);\n        NamespaceService namespaceService = mock(NamespaceService.class);\n        ReleaseHistoryService releaseHistoryService = mock(ReleaseHistoryService.class);\n        AuditService auditService = mock(AuditService.class);\n        NamespaceBranchService namespaceBranchService = new NamespaceBranchService(auditService, grayReleaseRuleRepository, clusterService, releaseService, namespaceService, releaseHistoryService);\n        String appId = \"someAppId\";\n        String clusterName = \"someClusterName\";\n        String namespaceName = \"someNamespaceName\";\n        String branchName = \"someBranchName\";\n        long latestReleaseId = 10L;\n        String operator = \"someOperator\";\n        \n        // Act\n        GrayReleaseRule result = namespaceBranchService.updateRulesReleaseId(appId, clusterName, namespaceName, branchName, latestReleaseId, operator);\n        \n        // Assert\n        assertEquals(latestReleaseId, result.getReleaseId());\n    }\n}",
        "\n@Test\npublic void updateRulesReleaseIdTest() {\n    GrayReleaseRule oldRules = mock(GrayReleaseRule.class);\n    when(oldRules.getAppId()).thenReturn(\"app1\");\n    when(oldRules.getClusterName()).thenReturn(\"cluster1\");\n    when(oldRules.getNamespaceName()).thenReturn(\"namespace1\");\n    when(oldRules.getBranchName()).thenReturn(\"branch1\");\n    when(oldRules.getReleaseId()).thenReturn(1L);\n\n    GrayReleaseRule newRules = mock(GrayReleaseRule.class);\n    when(newRules.getAppId()).thenReturn(\"app1\");\n    when(newRules.getClusterName()).thenReturn(\"cluster1\");\n    when(newRules.getNamespaceName()).thenReturn(\"namespace1\");\n    when(newRules.getBranchName()).thenReturn(\"branch1\");\n    when(newRules.getReleaseId()).thenReturn(2L);\n\n    NamespaceBranchService service = new NamespaceBranchService();\n\n    GrayReleaseRule result = service.updateRulesReleaseId(oldRules, newRules);\n\n    assertEquals(\"app1\", result.getAppId());\n    assertEquals(\"cluster1\", result.getClusterName());\n    assertEquals(\"namespace1\", result.getNamespaceName());\n    assertEquals(\"branch1\", result.getBranchName());\n    assertEquals(2L, result.getReleaseId());\n}",
        "package com.ctrip.framework.apollo.biz.service;\n\nimport org.junit.jupiter.api.*;\nimport static org.junit.jupiter.api.Assertions.*;\n\npublic class NamespaceBranchServiceTest {\n    @Mock\n    private GrayReleaseRuleRepository grayReleaseRuleRepository;\n    \n    @InjectMocks\n    private NamespaceBranchService service;\n    \n    @Test\n    public void updateRulesReleaseIdTest() {\n        // Set up mock objects and dependencies as needed\n        \n        String appId = \"test-app\";\n        String clusterName = \"test-cluster\";\n        String namespaceName = \"test-namespace\";\n        String branchName = \"test-branch\";\n        long latestReleaseId = 1234;\n        \n        // Call the method under test\n        GrayReleaseRule newRules = service.updateRulesReleaseId(appId, clusterName, namespaceName, branchName, latestReleaseId);\n        \n        // Verify that the returned object has the correct properties\n        assertEquals(latestReleaseId, newRules.getReleaseId());\n        assertEquals(\"ACTIVE\", newRules.getBranchStatus().toString());\n        assertEquals(1, newRules.getRules().size());\n    }\n}",
        "package com.ctrip.framework.apollo.biz.service;\n\nimport org.junit.jupiter.api.*;\nimport static org.junit.jupiter.api.Assertions.*;\n\npublic class NamespaceBranchServiceTest {\n    @Test\n    public void updateRulesReleaseIdTest() {\n        // Create a mock gray release rule repository\n        GrayReleaseRuleRepository mockGrayReleaseRuleRepository = Mockito.mock(GrayReleaseRuleRepository.class);\n        \n        // Set up the test data\n        String appId = \"testApp\";\n        String clusterName = \"testCluster\";\n        String namespaceName = \"testNamespace\";\n        String branchName = \"testBranch\";\n        long latestReleaseId = 10L;\n        String operator = \"testOperator\";\n        \n        // Create a mock gray release rule\n        GrayReleaseRule oldRules = new GrayReleaseRule();\n        oldRules.setAppId(appId);\n        oldRules.setClusterName(clusterName);\n        oldRules.setNamespaceName(namespaceName);\n        oldRules.setBranchName(branchName);\n        oldRules.setDataChangeCreatedBy(operator);\n        oldRules.setDataChangeLastModifiedBy(operator);\n        \n        // Set up the mock repository to return the old rule when findTopByAppIdAndClusterNameAndNamespaceNameAndBranchNameOrderByIdDesc is called\n        Mockito.when(mockGrayReleaseRuleRepository.findTopByAppIdAndClusterNameAndNamespaceNameAndBranchNameOrderByIdDesc(appId, clusterName, namespaceName, branchName)).thenReturn(oldRules);\n        \n        // Create a mock NamespaceBranchService object with the mock repository\n        NamespaceBranchService service = new NamespaceBranchService(mockGrayReleaseRuleRepository);\n        \n        // Call the updateRulesReleaseId method and assert that it returns the expected value\n        GrayReleaseRule newRules = service.updateRulesReleaseId(appId, clusterName, namespaceName, branchName, latestReleaseId, operator);\n        assertEquals(newRules.getAppId(), appId);\n        assertEquals(newRules.getClusterName(), clusterName);\n        assertEquals(newRules.getNamespaceName(), namespaceName);\n        assertEquals(newRules.getBranchName(), branchName);\n        assertNotNull(newRules.getDataChangeCreatedBy());\n        assertNotNull(newRules.getDataChangeLastModifiedBy());\n    }\n}"
    ]
}